{
  "$schema": "./feature-coverage.schema.json",
  "schemaVersion": 1,
  "protocolVersion": "2026-07-28",
  "authority": {
    "protocol": "src/generated/mcp/2026-07-28/McpProtocol.generated.ts",
    "capabilities": "sources/vendor/mcp-core/schema.json",
    "policy": "https://modelcontextprotocol.io/community/sdk-tiers"
  },
  "roleBoundaries": {
    "authorizationServer": "not-claimed",
    "experimentalCapabilities": "excluded-by-tier-policy"
  },
  "features": [
    {
      "id": "client-request:server/discover",
      "kind": "client-request",
      "protocolIdentifier": "server/discover",
      "status": "supported",
      "api": { "path": "src/McpClient.ts", "symbol": "discover" },
      "documentation": { "path": "docs/feature-coverage.md", "anchor": "protocol-requests" },
      "example": { "path": "examples/core-protocol-catalog.ts" },
      "tests": [{ "path": "test/client/wp5b-client-construction.test.mjs" }]
    },
    {
      "id": "client-request:completion/complete",
      "kind": "client-request",
      "protocolIdentifier": "completion/complete",
      "status": "supported",
      "api": { "path": "src/McpClient.ts", "symbol": "complete" },
      "documentation": { "path": "docs/feature-coverage.md", "anchor": "protocol-requests" },
      "example": { "path": "examples/core-protocol-catalog.ts" },
      "tests": [{ "path": "test/server/tier1-server-conformance.test.mjs" }]
    },
    {
      "id": "client-request:prompts/get",
      "kind": "client-request",
      "protocolIdentifier": "prompts/get",
      "status": "supported",
      "api": { "path": "src/McpClient.ts", "symbol": "getPrompt" },
      "documentation": { "path": "docs/feature-coverage.md", "anchor": "protocol-requests" },
      "example": { "path": "examples/core-protocol-catalog.ts" },
      "tests": [{ "path": "test/server/tier1-server-conformance.test.mjs" }]
    },
    {
      "id": "client-request:prompts/list",
      "kind": "client-request",
      "protocolIdentifier": "prompts/list",
      "status": "supported",
      "api": { "path": "src/McpClient.ts", "symbol": "listPrompts" },
      "documentation": { "path": "docs/feature-coverage.md", "anchor": "protocol-requests" },
      "example": { "path": "examples/core-protocol-catalog.ts" },
      "tests": [{ "path": "test/server/tier1-server-conformance.test.mjs" }]
    },
    {
      "id": "client-request:resources/list",
      "kind": "client-request",
      "protocolIdentifier": "resources/list",
      "status": "supported",
      "api": { "path": "src/McpClient.ts", "symbol": "listResources" },
      "documentation": { "path": "docs/feature-coverage.md", "anchor": "protocol-requests" },
      "example": { "path": "examples/core-protocol-catalog.ts" },
      "tests": [{ "path": "test/server/tier1-server-conformance.test.mjs" }]
    },
    {
      "id": "client-request:resources/templates/list",
      "kind": "client-request",
      "protocolIdentifier": "resources/templates/list",
      "status": "supported",
      "api": { "path": "src/McpClient.ts", "symbol": "listResourceTemplates" },
      "documentation": { "path": "docs/feature-coverage.md", "anchor": "protocol-requests" },
      "example": { "path": "examples/core-protocol-catalog.ts" },
      "tests": [{ "path": "test/server/tier1-server-conformance.test.mjs" }]
    },
    {
      "id": "client-request:resources/read",
      "kind": "client-request",
      "protocolIdentifier": "resources/read",
      "status": "supported",
      "api": { "path": "src/McpClient.ts", "symbol": "readResource" },
      "documentation": { "path": "docs/feature-coverage.md", "anchor": "protocol-requests" },
      "example": { "path": "examples/core-protocol-catalog.ts" },
      "tests": [{ "path": "test/server/tier1-server-conformance.test.mjs" }]
    },
    {
      "id": "client-request:subscriptions/listen",
      "kind": "client-request",
      "protocolIdentifier": "subscriptions/listen",
      "status": "supported",
      "api": { "path": "src/McpClient.ts", "symbol": "subscriptionsListen" },
      "documentation": { "path": "docs/feature-coverage.md", "anchor": "protocol-requests" },
      "example": { "path": "examples/core-protocol-catalog.ts" },
      "tests": [{ "path": "test/client/wp5g-subscription.test.mjs" }]
    },
    {
      "id": "client-request:tools/call",
      "kind": "client-request",
      "protocolIdentifier": "tools/call",
      "status": "supported",
      "api": { "path": "src/McpClient.ts", "symbol": "callTool" },
      "documentation": { "path": "docs/feature-coverage.md", "anchor": "protocol-requests" },
      "example": { "path": "examples/core-protocol-catalog.ts" },
      "tests": [{ "path": "test/server/tier1-server-conformance.test.mjs" }]
    },
    {
      "id": "client-request:tools/list",
      "kind": "client-request",
      "protocolIdentifier": "tools/list",
      "status": "supported",
      "api": { "path": "src/McpClient.ts", "symbol": "listTools" },
      "documentation": { "path": "docs/feature-coverage.md", "anchor": "protocol-requests" },
      "example": { "path": "examples/core-protocol-catalog.ts" },
      "tests": [{ "path": "test/server/tier1-server-conformance.test.mjs" }]
    },

    {
      "id": "client-notification:notifications/cancelled",
      "kind": "client-notification",
      "protocolIdentifier": "notifications/cancelled",
      "status": "supported",
      "api": { "path": "src/McpNotifications.ts", "symbol": "makeInboundDispatcher" },
      "documentation": { "path": "docs/feature-coverage.md", "anchor": "protocol-notifications" },
      "example": { "path": "examples/core-protocol-catalog.ts" },
      "tests": [{ "path": "test/client/wp5e-progress-cancellation.test.mjs" }]
    },

    {
      "id": "server-notification:notifications/cancelled",
      "kind": "server-notification",
      "protocolIdentifier": "notifications/cancelled",
      "status": "supported",
      "api": { "path": "src/McpServer.ts", "symbol": "publish" },
      "documentation": { "path": "docs/feature-coverage.md", "anchor": "protocol-notifications" },
      "example": { "path": "examples/everything-server.ts" },
      "tests": [{ "path": "test/client/everything-client-conformance.test.mjs" }]
    },
    {
      "id": "server-notification:notifications/progress",
      "kind": "server-notification",
      "protocolIdentifier": "notifications/progress",
      "status": "supported",
      "api": { "path": "src/McpServer.ts", "symbol": "sendProgress" },
      "documentation": { "path": "docs/feature-coverage.md", "anchor": "protocol-notifications" },
      "example": { "path": "examples/core-protocol-catalog.ts" },
      "tests": [{ "path": "test/client/wp5e-progress-cancellation.test.mjs" }]
    },
    {
      "id": "server-notification:notifications/message",
      "kind": "server-notification",
      "protocolIdentifier": "notifications/message",
      "status": "supported",
      "api": { "path": "src/deprecated.ts", "symbol": "sendLoggingMessage" },
      "documentation": { "path": "docs/feature-coverage.md", "anchor": "protocol-notifications" },
      "example": { "path": "examples/core-protocol-catalog.ts" },
      "tests": [{ "path": "test/client/everything-client-conformance.test.mjs" }]
    },
    {
      "id": "server-notification:notifications/resources/updated",
      "kind": "server-notification",
      "protocolIdentifier": "notifications/resources/updated",
      "status": "supported",
      "api": { "path": "src/McpServer.ts", "symbol": "sendResourceUpdated" },
      "documentation": { "path": "docs/feature-coverage.md", "anchor": "protocol-notifications" },
      "example": { "path": "examples/everything-server.ts" },
      "tests": [{ "path": "test/client/wp5g-subscription.test.mjs" }]
    },
    {
      "id": "server-notification:notifications/resources/list_changed",
      "kind": "server-notification",
      "protocolIdentifier": "notifications/resources/list_changed",
      "status": "supported",
      "api": { "path": "src/McpServer.ts", "symbol": "sendResourceListChanged" },
      "documentation": { "path": "docs/feature-coverage.md", "anchor": "protocol-notifications" },
      "example": { "path": "examples/everything-server.ts" },
      "tests": [{ "path": "test/client/wp5g-subscription.test.mjs" }]
    },
    {
      "id": "server-notification:notifications/tools/list_changed",
      "kind": "server-notification",
      "protocolIdentifier": "notifications/tools/list_changed",
      "status": "supported",
      "api": { "path": "src/McpServer.ts", "symbol": "sendToolListChanged" },
      "documentation": { "path": "docs/feature-coverage.md", "anchor": "protocol-notifications" },
      "example": { "path": "examples/everything-server.ts" },
      "tests": [{ "path": "test/client/wp5g-subscription.test.mjs" }]
    },
    {
      "id": "server-notification:notifications/prompts/list_changed",
      "kind": "server-notification",
      "protocolIdentifier": "notifications/prompts/list_changed",
      "status": "supported",
      "api": { "path": "src/McpServer.ts", "symbol": "sendPromptListChanged" },
      "documentation": { "path": "docs/feature-coverage.md", "anchor": "protocol-notifications" },
      "example": { "path": "examples/everything-server.ts" },
      "tests": [{ "path": "test/client/wp5g-subscription.test.mjs" }]
    },
    {
      "id": "server-notification:notifications/subscriptions/acknowledged",
      "kind": "server-notification",
      "protocolIdentifier": "notifications/subscriptions/acknowledged",
      "status": "supported",
      "api": { "path": "src/McpClient.ts", "symbol": "subscriptionsListen" },
      "documentation": { "path": "docs/feature-coverage.md", "anchor": "protocol-notifications" },
      "example": { "path": "examples/core-protocol-catalog.ts" },
      "tests": [{ "path": "test/client/wp5g-subscription.test.mjs" }]
    },

    {
      "id": "client-capability:elicitation",
      "kind": "client-capability",